內文,內文_清理後,內文_斷詞後,手動標註
跟S.H.E很好 然後林宥嘉真爽,跟SHE很好然後林宥嘉真爽,跟SHE很好然後林宥嘉真爽,0
臉書還在啊,臉書還在啊,臉書還在啊,0
國中的時候超想幹她,國中的時候超想幹她,國中的時候超想幹,0
關東煮的湯,關東煮的湯,關東煮的湯,0
米酒加維大力,米酒加維大力,米酒加維大力,0
小七酒不是都貴很多,小七酒不是都貴很多,小七酒不是都貴很多,0
假掰女代言的葡萄風味糖水,假掰女代言的葡萄風味糖水,假掰女代言的葡萄風味糖水,0
無糖綠、大熱拿,無糖綠、大熱拿,無糖綠、大熱拿,0
光那顆腦屌打我800回吧,光那顆腦屌打我800回吧,光顆腦屌打800回吧,0
有老婆你跟我說他邊緣?,有老婆你跟我說他邊緣,有老婆跟說邊緣,0
吃定他不會跳起來該所以都不發給他,吃定他不會跳起來該所以都不發給他,吃定不會跳起來該所以都不發給,0
霍金那個廣告 最後那個笑聲 是英國人的惡趣味嗎,霍金那個廣告最後那個笑聲是英國人的惡趣味嗎,霍金個廣告最後個笑聲是英國人的惡趣味嗎,0
其實他早就死了，現在那是電腦,其實他早就死了，現在那是電腦,其實早就死了，現在是電腦,0
麥克風才是本體,麥克風才是本體,麥克風才是本體,0
他的腦力應該突破到宇宙邊界了,他的腦力應該突破到宇宙邊界了,的腦力應該突破到宇宙邊界了,0
都有老婆了,都有老婆了,都有老婆了,0
外星人 感覺到危險了 就把他弄成這樣,外星人感覺到危險了就把他弄成這樣,外星人感覺到危險了就把弄成這樣,0
所以後來霍金對外星人就不太友善了,所以後來霍金對外星人就不太友善了,所以後來霍金對外星人就不太友善了,0
根本沒東西出來啊，又不是確定的事情,根本沒東西出來啊，又不是確定的事情,根本沒東西出來啊，又不是確定的事情,0
人家坐輪椅還能把妹，屌打肥宅,人家坐輪椅還能把妹，屌打肥宅,坐輪椅還能把妹，屌打肥宅,0
愛的萬物輪 哪裡邊緣,愛的萬物輪哪裡邊緣,愛的萬物輪哪裡邊緣,0
他交過兩個老婆 你勒？,他交過兩個老婆你勒？,交過兩個老婆勒？,0
他的實力不需要靠諾貝爾獎證明,他的實力不需要靠諾貝爾獎證明,的實力不需要靠諾貝爾獎證明,0
不能講話不能動都有老婆孩子,不能講話不能動都有老婆孩子,不能講話不能動都有老婆孩子,0
輪椅才是本體，上面的人確定是活的嗎？,輪椅才是本體，上面的人確定是活的嗎？,輪椅才是本體，上面的人確定是活的嗎？,0
跟銀魂的半藏一樣啊,跟銀魂的半藏一樣啊,跟銀魂的半藏一樣啊,0
外星人滅口失敗，所以變這個樣子,外星人滅口失敗，所以變這個樣子,外星人滅口失敗，所以變個樣子,0
他的理論沒辦法用實驗檢驗 基本上他沒機會得諾貝爾獎,他的理論沒辦法用實驗檢驗基本上他沒機會得諾貝爾獎,的理論沒辦法用實驗檢驗基本上沒機會得諾貝爾獎,0
他的研究還要過幾十年後才能證明…,他的研究還要過幾十年後才能證明,的研究還要過幾十年後才能證明,0
時空理論怎麼可能可能可以做實驗檢驗...,時空理論怎麼可能可能可以做實驗檢驗,時空理論怎麼可能可能可以做實驗檢驗,0
都是概念就拿不到了,都是概念就拿不到了,都是概念就拿不到了,0
他的理論外星人很危險需要外星人才能證實,他的理論外星人很危險需要外星人才能證實,的理論外星人很危險需要外星人才能證實,0
不覺得他多厲害,不覺得他多厲害,不覺得多厲害,0
諾貝爾獎不愛太理論的，愛因斯坦也是靠光電效應得獎 --,諾貝爾獎不愛太理論的，愛因斯坦也是靠光電效應得獎,諾貝爾獎不愛太理論的，愛因斯坦也是靠光電效應得獎,0
狹義和廣義相對論都沒得；雖然後兩者的原創性和影響力要,狹義和廣義相對論都沒得；雖然後兩者的原創性和影響力要,狹義和廣義相對論都沒得；雖然後者的原創性和影響力要,0
比前者高出不知幾百倍…,比前者高出不知幾百倍,比高出不知幾百倍,0
一個月只花三千,一個月只花三千,一個月只花三千,0
不要熬夜 少油少鹽 沒事路邊看到鳳梨就拔幾顆來吃,不要熬夜少油少鹽沒事路邊看到鳳梨就拔幾顆來吃,不要熬夜少油少鹽沒事路邊看到鳳梨就拔幾顆來吃,0
你有聽過安麗嗎?,你有聽過安麗嗎,有聽過安麗嗎,0
營養代餐，ㄏㄅㄈ,營養代餐，,營養代餐，,0
把錢都拿去買直銷 沒錢就會餓瘦了,把錢都拿去買直銷沒錢就會餓瘦了,把錢都拿去買直銷沒錢就會餓瘦了,0
9鎂好便宜,9鎂好便宜,9鎂好便宜,0
聽音樂不能充電哦,聽音樂不能充電哦,聽音樂不能充電哦,0
內建DAC 很猛,內建DAC很猛,內建DAC很猛,0
賺到了     我說蘋果光賣這條線,賺到了我說蘋果光賣這條線,賺到了說蘋果光賣條線,0
沒有收音機功能蘋果可以倒一倒了,沒有收音機功能蘋果可以倒一倒了,沒有收音機功能蘋果可以倒一倒了,0
為是App跟網路發展淘汰導致？,為是App跟網路發展淘汰導致？,為是App跟網路發展淘汰導致？,0
收音機這次颱風停電時才知它的好  爽用S3,收音機這次颱風停電時才知它的好爽用S3,收音機次颱風停電時才知的好爽用S3,0
重新定義無法使用耳機,重新定義無法使用耳機,重新定義無法使用耳機,0
二師兄  4ni,二師兄4ni,二師兄4ni,0
傑森史塔森：有頭髮的都過來,傑森史塔森：有頭髮的都過來,傑森史塔森：有頭髮的都過來,0
球得落:……,球得落,球得落,0
裘德洛 張孝全 高成這樣也是帥XD,裘德洛張孝全高成這樣也是帥XD,裘德洛張孝全高成這樣也是帥XD,0
裘德洛：拎杯達爾M形禿都屌打你們。,裘德洛：拎杯達爾M形禿都屌打你們。,裘德洛：拎杯達爾M形禿都屌打。,0
之前有研究說髮線高的帥哥就是真的帥 不是靠打扮帥的,之前有研究說髮線高的帥哥就是真的帥不是靠打扮帥的,之前有研究說髮線高的帥哥就是真的帥不是靠打扮帥的,0
這也算高?,這也算高,也算高,0
裘德洛還是帥度爆表,裘德洛還是帥度爆表,裘德洛還是帥度爆表,0
帥在哪，跟蛇精男哪裡不一樣?,帥在哪，跟蛇精男哪裡不一樣,帥在哪，跟蛇精男哪裡不一樣,0
兩個都選不會？,兩個都選不會？,兩個都選不會？,0
奶大的那個,奶大的那個,奶大的個,0
反正都不會選肥宅啊 問這幹嘛?,反正都不會選肥宅啊問這幹嘛,反正都不會選肥宅啊問幹嘛,0
......,,,0
肥宅有得選嗎,肥宅有得選嗎,肥宅有得選嗎,0
選胸部大的,選胸部大的,選胸部大的,0
都追不到 不要問我◢▆▅▄▃崩╰(〒皿〒)╯潰▃▄▅,都追不到不要問我崩皿潰,都追不到不要問崩皿潰,0
當然選個性好處女正妹~,當然選個性好處女正妹,當然選個性好處女正妹,0
奶大的處女 懂,奶大的處女懂,奶大的處女懂,0
怎樣都輪不到肥宅選  對 就是在講你,怎樣都輪不到肥宅選對就是在講你,怎樣都輪不到肥宅選對就是在講,0
這還要選？？,這還要選？？,還要選？？,0
誰都沒差，反正人家又看不上肥宅,誰都沒差，反正人家又看不上肥宅,都沒差，反正又看不上肥宅,0
反正她們都不會選你,反正她們都不會選你,反正都不會選,0
這因變變因不只一個  是要選三小,這因變變因不只一個是要選三小,因變變因不只一個是要選三小,0
我選20歲奶大個性又好的處女正妹,我選20歲奶大個性又好的處女正妹,選20歲奶大個性又好的處女正妹,0
二分法很白痴，有的人適合第一個有的適合第二個，照,二分法很白痴，有的人適合第一個有的適合第二個，照,二分法很白痴，有的人適合第一個有的適合第二個，照,0
先把完個性差的 然後跟她鬧翻 再找個性好的正妹 很難嗎,先把完個性差的然後跟她鬧翻再找個性好的正妹很難嗎,先把完個性差的然後跟鬧翻再找個性好的正妹很難嗎,0
當然是個性好的又正的 你腦子有問題嘛 這有什麼好選的,當然是個性好的又正的你腦子有問題嘛這有什麼好選的,當然是個性好的又正的腦子有問題嘛有好選的,0
有%%%過會撒嬌的正妹技巧大概不錯,有過會撒嬌的正妹技巧大概不錯,有過會撒嬌的正妹技巧大概不錯,0
這年頭想要處?去保溫箱找吧,這年頭想要處去保溫箱找吧,年頭想要處去保溫箱找吧,0
象腿還脾氣差  那還不如買個越南的,象腿還脾氣差那還不如買個越南的,象腿還脾氣差還不如買個越南的,0
那個普妹搞不好選了也吃不到 投資心酸的,那個普妹搞不好選了也吃不到投資心酸的,個普妹搞不好選了也吃不到投資心酸的,0
第一個感覺沒優點這要想啥,第一個感覺沒優點這要想啥,第一個感覺沒優點要想,0
幻想文喔  你是有得選膩,幻想文喔你是有得選膩,幻想文喔是有得選膩,0
也不看看自己個性，糟的個性遇到糟的，好的個性跟好,也不看看自己個性，糟的個性遇到糟的，好的個性跟好,也不看看個性，糟的個性遇到糟的，好的個性跟好,0
相處的合，你挑人，人家也挑你，懂?,相處的合，你挑人，人家也挑你，懂,相處的合，挑人，也挑，懂,0
自以為有得選，笑了,自以為有得選，笑了,自以為有得選，笑了,0
誰打炮會想找處女啊,誰打炮會想找處女啊,打炮會想找處女啊,0
當然正的，雖然正的看不上阿宅,當然正的，雖然正的看不上阿宅,當然正的，雖然正的看不上阿宅,0
我是被虐狂 選第一個吧,我是被虐狂選第一個吧,是被虐狂選第一個吧,0
說真的 處女還要開發很麻煩,說真的處女還要開發很麻煩,說真的處女還要開發很麻煩,0
被氣死好過被尅死!!懂??,被氣死好過被尅死懂,被氣死好過被尅死懂,0
選正妹結果一卸妝...,選正妹結果一卸妝,選正妹結果一卸妝,0
肥宅是要選三小,肥宅是要選三小,肥宅是要選三小,0
選胸部大的,選胸部大的,選胸部大的,0
當然選奶大的,當然選奶大的,當然選奶大的,0
趕快簽下去啊,趕快簽下去啊,趕快簽下去啊,0
你太適合簽了,你太適合簽了,太適合簽了,0
投資有賺有賠，請小心投資。,投資有賺有賠，請小心投資。,投資有賺有賠，請小心投資。,0
任何投資都是有風險的，請謹慎投資。,任何投資都是有風險的，請謹慎投資。,任何投資都是有風險的，請謹慎投資。,0
不應該把投資視為一切請依照自身能力決定。,不應該把投資視為一切請依照自身能力決定。,不應該把投資視為一切請依照能力決定。,0
簽下去 你就能敘舊了,簽下去你就能敘舊了,簽下去就能敘舊了,0
在湖口車站的那間網咖打到早上  還在 ok商店吃宵夜,在湖口車站的那間網咖打到早上還在ok商店吃宵夜,在湖口車站的間網咖打到早上還在ok商店吃宵夜,0
兵變齁 退伍都馬上...,兵變齁退伍都馬上,兵變齁退伍都馬上,0
讓麥當當安慰你的心,讓麥當當安慰你的心,讓麥當當安慰的心,0
去找工作啦幹,去找工作啦幹,去找工作啦幹,0
奴性夠重，還不快簽下去，不簽可惜,奴性夠重，還不快簽下去，不簽可惜,奴性夠重，還不快簽下去，不簽可惜,0
退伍治百病 爽,退伍治百病爽,退伍治百病爽,0
再過兩三天你就有退的fu了,再過兩三天你就有退的fu了,再過兩三天就有退的fu了,0
你一定在想念士官長的肉棒,你一定在想念士官長的肉棒,一定在想念士官長的肉棒,0
在軍中被塞的滿滿的吼  退伍就空虛了吧,在軍中被塞的滿滿的吼退伍就空虛了吧,在軍中被塞的滿滿的吼退伍就空虛了吧,0
30歲前好像還能簽下去？,30歲前好像還能簽下去？,30歲前好像還能簽下去？,0
退伍後一個禮拜 換同梯沒折抵退 去高雄營區外網咖打咖打,退伍後一個禮拜換同梯沒折抵退去高雄營區外網咖打咖打,退伍後一個禮拜換同梯沒折抵退去高雄營區外網咖打咖打,0
到早上 然後說再見,到早上然後說再見,到早上然後說再見,0
當初退伍本來想風光和裡面學姐妹吃大餐 最後只有和一學長,當初退伍本來想風光和裡面學姐妹吃大餐最後只有和一學長,當初退伍本來想風光和裡面學姐妹吃大餐最後只有和一學長,0
兩學長吃新園牛肉鍋吃完默默抽菸搭火車,兩學長吃新園牛肉鍋吃完默默抽菸搭火車,兩學長吃新園牛肉鍋吃完默默抽菸搭火車,0
從我退伍後 作息沒有一天正常,從我退伍後作息沒有一天正常,從退伍後作息沒有一天正常,0
你有當到ATM工具人 陪同墮胎工具人嗎,你有當到ATM工具人陪同墮胎工具人嗎,有當到ATM工具人陪同墮胎工具人嗎,0
之前有個工具人工頭  想到又幫QQ了,之前有個工具人工頭想到又幫QQ了,之前有個工具人工頭想到又幫QQ了,0
這年頭當工具人也要$$$$$$$$$$了,這年頭當工具人也要了,年頭當工具人也要了,0
工具人最高等級可以叫什麼?,工具人最高等級可以叫什麼,工具人最高等級可以叫,0
安安  邊邊我I7八核心工具人,安安邊邊我I7八核心工具人,安安邊邊I7八核心工具人,0
工具人工頭來了  goo.gl/OKcqz5,工具人工頭來了googlOKcqz5,工具人工頭來了googlOKcqz5,0
我的等級是幫女生帶150個人團隊,我的等級是幫女生帶150個人團隊,的等級是幫女生帶150個人團隊,0
因為工具人很多不缺你一個,因為工具人很多不缺你一個,因為工具人很多不缺一個,0
有啊 不然你以為工頭叫假的啊,有啊不然你以為工頭叫假的啊,有啊不然以為工頭叫假的啊,0
看你是當一個女生的工具人 還是多個,看你是當一個女生的工具人還是多個,看是當一個女生的工具人還是多個,0
斗六某個店員好有氣質 不過關了,斗六某個店員好有氣質不過關了,斗六某個店員好有氣質不過關了,0
一樣的錢還不如自己去頂好買材料回家煮,一樣的錢還不如自己去頂好買材料回家煮,一樣的錢還不如去頂好買材料回家煮,0
只有冰沙ok,只有冰沙ok,只有冰沙ok,0
CP值高平價好吃阿,CP值高平價好吃阿,CP值高平價好吃阿,0
爛...位子很擠、連醬料佐料都要跟店員要材給,爛位子很擠、連醬料佐料都要跟店員要材給,爛位子很擠、連醬料佐料都要跟店員要材給,0
以涮涮鍋的價位算便宜吧,以涮涮鍋的價位算便宜吧,以涮涮鍋的價位算便宜吧,0
吃過一次就賭爛,吃過一次就賭爛,吃過一次就賭爛,0
輕井澤屌打12鍋,輕井澤屌打12鍋,輕井澤屌打12鍋,0
公司勞動節發三張這家的餐券......,公司勞動節發三張這家的餐券,公司勞動節發三張家的餐券,0
"最佳品牌形象代言人馬囧:""一鍋食不飽，何不食二鍋?""",最佳品牌形象代言人馬囧一鍋食不飽，何不食二鍋,最佳品牌形象代言人馬囧一鍋食不飽，何不食二鍋,0
五冠扒衣105人二鍋,五冠扒衣105人二鍋,五冠扒衣105人二鍋,0
備料的時間人力算進去嗎,備料的時間人力算進去嗎,備料的時間人力算進去嗎,0
輕井澤屌打+1 不過好像台中以南才有QQ,輕井澤屌打1不過好像台中以南才有QQ,輕井澤屌打1不過好像台中以南才有QQ,0
覺得料很少,覺得料很少,覺得料很少,0
滷肉飯很好吃!!,滷肉飯很好吃,滷肉飯很好吃,0
有時候等待的時間就跟備料時間差不多了XD,有時候等待的時間就跟備料時間差不多了XD,有時候等待的時間就跟備料時間差不多了XD,0
普通 只是人很多很不爽,普通只是人很多很不爽,普通只是人很多很不爽,0
以前算便宜阿200內一鍋  現在漲到哪了???,以前算便宜阿200內一鍋現在漲到哪了,以前算便宜阿200內一鍋現在漲到哪了,0
假的石頭火鍋,假的石頭火鍋,假的石頭火鍋,0
住台南的屏東人表示 很難吃,住台南的屏東人表示很難吃,住台南的屏東人表示很難吃,0
不覺得有什麼特別的，需要排隊成那樣,不覺得有什麼特別的，需要排隊成那樣,不覺得有特別的，需要排隊成那樣,0
"不知道在排啥,還不如吃喜憨兒養生鍋，還可以幫助弱勢",不知道在排啥還不如吃喜憨兒養生鍋，還可以幫助弱勢,不知道在排還不如吃喜憨兒養生鍋，還可以幫助弱勢,0
平價吃的飽環境舒適,平價吃的飽環境舒適,平價吃的飽環境舒適,0
哪裡有吃到飽？？,哪裡有吃到飽？？,哪裡有吃到飽？？,0
我寧願吃三媽，反正都差不多價格差一倍,我寧願吃三媽，反正都差不多價格差一倍,寧願吃三媽，反正都差不多價格差一倍,0
就百元鍋多幾片肉 然後多幾十塊一樣,就百元鍋多幾片肉然後多幾十塊一樣,就百元鍋多幾片肉然後多幾十塊一樣,0
青景責才難吃,青景責才難吃,青景責才難吃,0
說自己買料的 家裡有養牛或豬!?,說自己買料的家裡有養牛或豬,說買料的家裡有養牛或豬,0
唯一支持輕井澤,唯一支持輕井澤,唯一支持輕井澤,0
沒知識又愛假掰的窮裝凱吃的高級垃圾,沒知識又愛假掰的窮裝凱吃的高級垃圾,沒知識又愛假掰的窮裝凱吃的高級垃圾,0
看圖以為是韓國人,看圖以為是韓國人,看圖以為是韓國人,0
不要侮辱我最愛的grunge團,不要侮辱我最愛的grunge團,不要侮辱最愛的grunge團,0
人家可以進搖滾名人堂，你胡睿兒甚麼咖,人家可以進搖滾名人堂，你胡睿兒甚麼咖,可以進搖滾名人堂，胡睿兒咖,0
.....,,,0
拿Kurt跟這咖比  你自盡吧,拿Kurt跟這咖比你自盡吧,拿Kurt跟咖比自盡吧,0
快學kurt自盡,快學kurt自盡,快學kurt自盡,0
這樣侮辱人的?,這樣侮辱人的,這樣侮辱人的,0
科特現在很想死 所以你可以殺死死人 真了不起,科特現在很想死所以你可以殺死死人真了不起,科特現在很想死所以可以殺死死人真了不起,0
標準的藍八比雞腿,標準的藍八比雞腿,標準的藍八比雞腿,0
XX比雞腿,XX比雞腿,XX比雞腿,0
別污辱kurt,別污辱kurt,別污辱kurt,0
不要亂比......,不要亂比,不要亂比,0
幹 等你一首歌變成全世界搖滾國歌再來談啦,幹等你一首歌變成全世界搖滾國歌再來談啦,幹等一首歌變成全世界搖滾國歌再來談啦,0
哈哈哈哈哈哈 群體嘲諷,哈哈哈哈哈哈群體嘲諷,哈哈哈哈哈哈群體嘲諷,0
別侮辱kurt喇,別侮辱kurt喇,別侮辱kurt喇,0
什麼台灣Nirvana 啦，滾,什麼台灣Nirvana啦，滾,台灣Nirvana啦，滾,0
XDDDDDDD,XDDDDDDD,XDDDDDDD,0
誰人甲我比！,誰人甲我比！,甲比！,0
大麻？恁北注海落英ㄟ啦！,大麻？恁北注海落英啦！,大麻？北注海落英啦！,0
雞腿比大腿喔,雞腿比大腿喔,雞腿比大腿喔,0
少年氣味這種咬字不清的糞歌怎麼跟癡情玫瑰花比？胡鬧,少年氣味這種咬字不清的糞歌怎麼跟癡情玫瑰花比？胡鬧,少年氣味種咬字不清的糞歌怎麼跟癡情玫瑰花比？胡鬧,0
你少汙辱了,你少汙辱了,少汙辱了,0
連十萬分之一都不如,連十萬分之一都不如,連十萬分之一都不如,0
趕快去洗洗睡啦,趕快去洗洗睡啦,趕快去洗洗睡啦,0
台灣糞樂製造者,台灣糞樂製造者,台灣糞樂製造者,0
這種算人？,這種算人？,種算人？,0
最好吸毒吸到死,最好吸毒吸到死,最好吸毒吸到死,0
XDDDDDDDDDDDDDDDDDDDDDDDDDD,XDDDDDDDDDDDDDDDDDDDDDDDDDD,XDDDDDDDDDDDDDDDDDDDDDDDDDD,0
我也那麼覺得,我也那麼覺得,也那麼覺得,0
大家一起來,大家一起來,一起來,0
還問Queen 跟 Bob Dylan,還問Queen跟BobDylan,還問Queen跟BobDylan,0
靠北喔 幹媽的 欠虛喔,靠北喔幹媽的欠虛喔,靠北喔幹媽的欠虛喔,0
投資有賺有賠，請小心投資。,投資有賺有賠，請小心投資。,投資有賺有賠，請小心投資。,0
任何投資都是有風險的，請謹慎投資。,任何投資都是有風險的，請謹慎投資。,任何投資都是有風險的，請謹慎投資。,0
不應該把投資視為一切請依照自身能力決定。,不應該把投資視為一切請依照自身能力決定。,不應該把投資視為一切請依照能力決定。,0
幹，小人國的懶覺比巨人國的雞腿！,幹，小人國的懶覺比巨人國的雞腿！,幹，小人國的懶覺比巨人國的雞腿！,0
髒髒老肉體 想裝小男孩 哪裡俊俏? 什麼睿兒? 明明就髒老睿,髒髒老肉體想裝小男孩哪裡俊俏什麼睿兒明明就髒老睿,髒髒老肉體想裝小男孩哪裡俊俏睿兒明明就髒老睿,0
瘦瘦的好像竹竿，瘦是瘦沒錯，但是體質髒髒。想裝嫩,瘦瘦的好像竹竿，瘦是瘦沒錯，但是體質髒髒。想裝嫩,瘦瘦的好像竹竿，瘦是瘦沒錯，但是體質髒髒。想裝嫩,0
現在都用無人機開轟了啦,現在都用無人機開轟了啦,現在都用無人機開轟了啦,0
自已去網飛看毒梟就知了,自已去網飛看毒梟就知了,去網飛看毒梟就知了,0
隨便找個理由就開戰了吧ㄎㄎ,隨便找個理由就開戰了吧,隨便找個理由就開戰了吧,0
等著看笑話 看他要怎麼突破重重防禦,等著看笑話看他要怎麼突破重重防禦,等著看笑話看要怎麼突破重重防禦,0
殺個EDA都怕怕   還想殺米國總統,殺個EDA都怕怕還想殺米國總統,殺個EDA都怕怕還想殺米國總統,0
會再選出下一個總統，總統其實只是一個代議政治下的產物~,會再選出下一個總統，總統其實只是一個代議政治下的產物,會再選出下一個總統，總統其實只是一個代議政治下的產物,0
菲律賓總統都殺不了要殺到美國...,菲律賓總統都殺不了要殺到美國,菲律賓總統都殺不了要殺到美國,0
吸到腦袋壞掉才會幹這種蠢事,吸到腦袋壞掉才會幹這種蠢事,吸到腦袋壞掉才會幹種蠢事,0
"美國：傑森包恩 John wick,Robert McCall，bob Lee swag",美國：傑森包恩JohnwickRobertMcCall，bobLeeswag,美國：傑森包恩JohnwickRobertMcCall，bobLeeswag,0
自己選一個吧,自己選一個吧,選一個吧,0
還沒踏進美國的領土 就被滅掉了,還沒踏進美國的領土就被滅掉了,還沒踏進美國的領土就被滅掉了,0
隊長不昰幹假的,隊長不昰幹假的,隊長不昰幹假的,0
不是有說毒梟是CIA控制的嗎? 當做資金來源之一,不是有說毒梟是CIA控制的嗎當做資金來源之一,不是有說毒梟是CIA控制的嗎當做資金來源之一,0
我們全部種田好不好，符合低污染歐,我們全部種田好不好，符合低污染歐,全部種田好不好，符合低污染歐,0
你先搞清楚進口替代四個字的意思,你先搞清楚進口替代四個字的意思,先搞清楚進口替代四個字的意思,0
文組的理想世界啊！晴耕雨讀,文組的理想世界啊！晴耕雨讀,文組的理想世界啊！晴耕雨讀,0
民進黨支持者不是醫生望族等級就是農民，沒有在管經濟的,民進黨支持者不是醫生望族等級就是農民，沒有在管經濟的,民進黨支持者不是醫生望族等級就是農民，沒有在管經濟的,0
大家清談就飽了,大家清談就飽了,清談就飽了,0
事実上是該転型，就是滾啦淦,事実上是該転型，就是滾啦淦,事実上是該転型，就是滾啦淦,0
刁民：做不到不重要，重要的是我有參與公共決策的心,刁民：做不到不重要，重要的是我有參與公共決策的心,刁民：做不到不重要，重要的是有參與公共決策的心,0
啊是不會做好回收排放標準喔！做不到的企業！滾～～,啊是不會做好回收排放標準喔！做不到的企業！滾,啊是不會做好回收排放標準喔！做不到的企業！滾,0
哼！想約炮還搞那麼多小動作，是不會學我膩,哼！想約炮還搞那麼多小動作，是不會學我膩,哼！想約炮還搞那麼多小動作，是不會學膩,0
畫質劇本大勝,畫質劇本大勝,畫質劇本大勝,0
如果以後閃軌3繼續這樣爛下去 別說英雄傳說系列,如果以後閃軌3繼續這樣爛下去別說英雄傳說系列,如果以後閃軌3繼續這樣爛下去別說英雄傳說系列,0
法爾康還有辦法撐多久都是問題,法爾康還有辦法撐多久都是問題,法爾康還有辦法撐多久都是問題,0
神作到來 空軌下跪(大將軍調,神作到來空軌下跪大將軍調,神作到來空軌下跪大將軍調,0
把英傳系列的標題拿掉是不想要有系列作包袱在吧,把英傳系列的標題拿掉是不想要有系列作包袱在吧,把英傳系列的標題拿掉是不想要有系列作包袱在吧,0
雖然演到現在軌跡也12年了~~,雖然演到現在軌跡也12年了,雖然演到現在軌跡也12年了,0
拜託別來 閃二想這樣搞已經夠糟糕了,拜託別來閃二想這樣搞已經夠糟糕了,拜託別來閃二想這樣搞已經夠糟糕了,0
不是在碧軌的結局時就已經向空軌道別了嗎，為了銷量還是,不是在碧軌的結局時就已經向空軌道別了嗎，為了銷量還是,不是在碧軌的結局時就已經向空軌道別了嗎，為了銷量還是,0
得把他們拖出來呀 XD,得把他們拖出來呀XD,得把拖出來呀XD,0
英雄傳說的標題一直都沒拿掉吧,英雄傳說的標題一直都沒拿掉吧,英雄傳說的標題一直都沒拿掉吧,0
