內文,內文_清理後,內文_斷詞後,手動標註
孫文當初也是用大清國護照出去海外募款的 北七,孫文當初也是用大清國護照出去海外募款的北七,孫文當初也是用大清國護照出去海外募款的北七,0
幹譙半天 講到錢不敢講[台幣] 改講[ROC貨幣] 哈哈哈,幹譙半天講到錢不敢講台幣改講ROC貨幣哈哈哈,幹譙半天講到錢不敢講台幣改講ROC貨幣哈哈哈,0
靠北啊ＲＯＣ也拿我好處 收我稅啊,靠北啊也拿我好處收我稅啊,靠北啊也拿好處收稅啊,0
滯台支那崩潰了？,滯台支那崩潰了？,滯台支那崩潰了？,0
建國我就換新身分證，你不要換喔！要留中華民國身分證,建國我就換新身分證，你不要換喔！要留中華民國身分證,建國就換新身分證，不要換喔！要留中華民國身分證,0
中國人大多沒有民主素養 大家別見怪,中國人大多沒有民主素養大家別見怪,中國人大多沒有民主素養別見怪,0
我能選擇嗎？你一定不是台灣人吧,我能選擇嗎？你一定不是台灣人吧,能選擇嗎？一定不是台灣人吧,0
你以為錢哪來的？,你以為錢哪來的？,以為錢哪來的？,0
你們中國人到底有多閒？管到別人家的家務事可以怎樣,你們中國人到底有多閒？管到別人家的家務事可以怎樣,中國人到底有多閒？管到家的家務事可以怎樣,0
幹你娘 什麼拿ROC好處 幹你娘凜北有繳稅 糙,幹你娘什麼拿ROC好處幹你娘凜北有繳稅糙,幹你娘拿ROC好處幹凜北有繳稅糙,0
ROC的好處我們台灣人堆出來的  懂?,ROC的好處我們台灣人堆出來的懂,ROC的好處台灣人堆出來的懂,0
台灣被霸佔了 還好意思說,台灣被霸佔了還好意思說,台灣被霸佔了還好意思說,0
你住台灣卻不認台灣，你也可以滾啊，中什麼華民國,你住台灣卻不認台灣，你也可以滾啊，中什麼華民國,住台灣卻不認台灣，也可以滾啊，中華民國,0
中國難民馬上滾回中國 一定馬上燒掉,中國難民馬上滾回中國一定馬上燒掉,中國難民馬上滾回中國一定馬上燒掉,0
我老闆的老婆就是會計師,我老闆的老婆就是會計師,老闆的老婆就是會計師,0
廢物任性老闆娘 以為所有人都要受氣,廢物任性老闆娘以為所有人都要受氣,廢物任性老闆娘以為所有人都要受氣,0
是…通常苛扣員工的一向都是女人（不一定是正宮）,是通常苛扣員工的一向都是女人（不一定是正宮）,是通常苛扣員工的一向都是女人（不一定是正宮）,0
董娘 皇親國戚你敢嘴？,董娘皇親國戚你敢嘴？,董娘皇親國戚敢嘴？,0
沒錯，以前就是這種老闆娘，將所有員工氣跑的,沒錯，以前就是這種老闆娘，將所有員工氣跑的,沒錯，以前就是種老闆娘，將所有員工氣跑的,0
很容易變成資方的豬隊友,很容易變成資方的豬隊友,很容易變成資方的豬隊友,0
不一定耶 有見過老闆只是裝飾 業務財務生產採購一把抓,不一定耶有見過老闆只是裝飾業務財務生產採購一把抓,不一定耶有見過老闆只是裝飾業務財務生產採購一把抓,0
由老闆娘一肩扛的小型企業,由老闆娘一肩扛的小型企業,由老闆娘一肩扛的小型企業,0
現在的才廢 老一輩的老闆娘都猛的跟什麼一樣,現在的才廢老一輩的老闆娘都猛的跟什麼一樣,現在的才廢老一輩的老闆娘都猛的跟一樣,0
是，很多加盟店老闆娘都白痴,是，很多加盟店老闆娘都白痴,是，很多加盟店老闆娘都白痴,0
之前打工的地方，看老闆娘70幾歲跟員工一起做事，老闆在,之前打工的地方，看老闆娘70幾歲跟員工一起做事，老闆在,之前打工的地方，看老闆娘70幾歲跟員工一起做事，老闆在,0
旁閒晃跑腿XD,旁閒晃跑腿XD,旁閒晃跑腿XD,0
記得看醫生。。。,記得看醫生。。。,記得看醫生。。。,0
掰，進桶吧,掰，進桶吧,掰，進桶吧,0
凸( ﾟдﾟ)凸工沙小,凸凸工沙小,凸凸工沙小,0
跟餐廳吃到飽但一次只給你一盤又限1.5小時吃完有87%像,跟餐廳吃到飽但一次只給你一盤又限15小時吃完有87像,跟餐廳吃到飽但一次只給一盤又限15小時吃完有87像,0
正常啊 合約有保證你的連線速度嗎,正常啊合約有保證你的連線速度嗎,正常啊合約有保證的連線速度嗎,0
自然限速而已 別怕,自然限速而已別怕,自然限速而已別怕,0
幹 我才要NP去中華 你遠傳派來了嗎 退火了,幹我才要NP去中華你遠傳派來了嗎退火了,幹才要NP去中華遠傳派來了嗎退火了,0
趕快收集證據吉種花啊 還要我教?,趕快收集證據吉種花啊還要我教,趕快收集證據吉種花啊還要教,0
499都嫌貴了還699,499都嫌貴了還699,499都嫌貴了還699,0
遠傳有比較好嗎,遠傳有比較好嗎,遠傳有比較好嗎,0
有沒有爛室友的8掛?,有沒有爛室友的8掛,有沒有爛室友的8掛,0
貪生怕死請入此門,貪生怕死請入此門,貪生怕死請入門,0
"超腦補, 電影預告片的分析跟實際上映的劇情發展完全不同",超腦補電影預告片的分析跟實際上映的劇情發展完全不同,超腦補電影預告片的分析跟實際上映的劇情發展完全不同,0
"不要露臉比較好,大家才不會被他的死宅臉嚇到",不要露臉比較好大家才不會被他的死宅臉嚇到,不要露臉比較好才不會被的死宅臉嚇到,0
聲音不是很順耳 聽他講到一半會很想把影片關掉,聲音不是很順耳聽他講到一半會很想把影片關掉,聲音不是很順耳聽講到一半會很想把影片關掉,0
還有竟然捧SS這部絕世糞片 從此以後再也不看他的影評,還有竟然捧SS這部絕世糞片從此以後再也不看他的影評,還有竟然捧SS部絕世糞片從此以後再也不看的影評,0
聲音跟臉差很多 我只看他媽佛電影以外的影評,聲音跟臉差很多我只看他媽佛電影以外的影評,聲音跟臉差很多只看電影以外的影評,0
比吉阿莫好多,比吉阿莫好多,比吉阿莫好多,0
聲音很難聽,聲音很難聽,聲音很難聽,0
我寧可看古阿莫評論也不想看超粒方腦補,我寧可看古阿莫評論也不想看超粒方腦補,寧可看古阿莫評論也不想看超粒方腦補,0
以前喜歡看，現在太多電影公司廣告心得文,以前喜歡看，現在太多電影公司廣告心得文,以前喜歡看，現在太多電影公司廣告心得文,0
超立方好醜,超立方好醜,超立方好醜,0
影評人只愛膝關節,影評人只愛膝關節,影評人只愛膝關節,0
看他批評谷阿莫的文章 就覺得87,看他批評谷阿莫的文章就覺得87,看批評谷阿莫的文章就覺得87,0
我看我是RT  XD,我看我是RTXD,看是RTXD,0
RT超幽默,RT超幽默,RT超幽默,0
以前起碼會花時間介紹漫威現在多了銅臭味,以前起碼會花時間介紹漫威現在多了銅臭味,以前起碼會花時間介紹漫威現在多了銅臭味,0
而且抄別人抄很大抄不用錢，超級沒料,而且抄別人抄很大抄不用錢，超級沒料,而且抄抄很大抄不用錢，超級沒料,0
他的評論標準蠻奇怪的 同樣是致敬的片段 有些電影,他的評論標準蠻奇怪的同樣是致敬的片段有些電影,的評論標準蠻奇怪的同樣是致敬的片段有些電影,0
可以被他說成是致敬 有些被他說成抄襲無新意,可以被他說成是致敬有些被他說成抄襲無新意,可以被說成是致敬有些被說成抄襲無新意,0
這傢伙 哈哈哈,這傢伙哈哈哈,傢伙哈哈哈,0
可是囧星人比X阿莫 超X方都還要早耶,可是囧星人比X阿莫超X方都還要早耶,可是囧星人比X阿莫超X方都還要早耶,0
看過囧星人就看不下他的了,看過囧星人就看不下他的了,看過囧星人就看不下的了,0
囧星人超早 結果跟他打ow一樣邊緣,囧星人超早結果跟他打ow一樣邊緣,囧星人超早結果跟打ow一樣邊緣,0
囧星人也很常提自己不受大眾歡迎XDD,囧星人也很常提自己不受大眾歡迎XDD,囧星人也很常提不受歡迎XDD,0
不是歡迎啦，比較紅不起來（？,不是歡迎啦，比較紅不起來（？,不是歡迎啦，比較紅不起來（？,0
邊聽邊尷尬,邊聽邊尷尬,邊聽邊尷尬,0
討論影評結果攻擊長相 這水準^^,討論影評結果攻擊長相這水準,討論影評結果攻擊長相水準,0
玻璃心很容易碎,玻璃心很容易碎,玻璃心很容易碎,0
最奇怪的是 粉絲會拿這些youtuber的評論當聖旨 最明顯,最奇怪的是粉絲會拿這些youtuber的評論當聖旨最明顯,最奇怪的是粉絲會拿這些youtuber的評論當聖旨最明顯,0
"的就是那個""瑪莎~~""",的就是那個瑪莎,的就是個瑪莎,0
囧星人很久之前就出現了,囧星人很久之前就出現了,囧星人很久之前就出現了,0
他漫威的那些內容也是去問別人的 自己沒懂很多,他漫威的那些內容也是去問別人的自己沒懂很多,漫威的那些內容也是去問的沒懂很多,0
被攻擊長相不是到處都有嗎 歌星 演員 甚至表特路人,被攻擊長相不是到處都有嗎歌星演員甚至表特路人,被攻擊長相不是到處都有嗎歌星演員甚至表特路人,0
越來越不喜歡他  跟觀眾互動口氣很差,越來越不喜歡他跟觀眾互動口氣很差,越來越不喜歡跟觀眾互動口氣很差,0
你知道囧星人是大師姐嗎？,你知道囧星人是大師姐嗎？,知道囧星人是大師姐嗎？,0
"其實也只看他的美漫英雄介紹以及彩蛋解說,完全不在意他",其實也只看他的美漫英雄介紹以及彩蛋解說完全不在意他,其實也只看的美漫英雄介紹以及彩蛋解說完全不在意,0
超愛囧星人,超愛囧星人,超愛囧星人,0
捧ss被看破手腳,捧ss被看破手腳,捧ss被看破手腳,0
囧星人只走自己的風格，跟其他人不同等級,囧星人只走自己的風格，跟其他人不同等級,囧星人只走的風格，跟其他人不同等級,0
咬字聽起來很不舒服,咬字聽起來很不舒服,咬字聽起來很不舒服,0
再爛都不會比古差...說寧願看古的我都笑了,再爛都不會比古差說寧願看古的我都笑了,再爛都不會比古差說寧願看古的都笑了,0
谷是集團策劃欸，其他人多是獨力製作,谷是集團策劃欸，其他人多是獨力製作,谷是集團策劃欸，其他人多是獨力製作,0
上次去中國拍到的古阿明是真的還假的 會是其中一個團隊成,上次去中國拍到的古阿明是真的還假的會是其中一個團隊成,上次去中國拍到的古阿明是真的還假的會是一個團隊成,0
員假扮的嗎,員假扮的嗎,員假扮的嗎,0
只有囧星人才是真正的影評,只有囧星人才是真正的影評,只有囧星人才是真正的影評,0
法蘭克 超粒方還有個刁菸斗的狗 這三個動漫電影介紹比較,法蘭克超粒方還有個刁菸斗的狗這三個動漫電影介紹比較,法蘭克超粒方還有個刁菸斗的狗三個動漫電影介紹比較,0
專精 古阿莫就純搞笑用的,專精古阿莫就純搞笑用的,專精古阿莫就純搞笑用的,0
貪生怕死請入此門,貪生怕死請入此門,貪生怕死請入門,0
終身志願役上兵吧,終身志願役上兵吧,終身志願役上兵吧,0
升官發財請入此門,升官發財請入此門,升官發財請入門,0
這是我對國民黨匪偽國軍的深刻體悟,這是我對國民黨匪偽國軍的深刻體悟,是對國民黨匪偽國軍的深刻體悟,0
學長會搶著讓你飛~高~高~~~~~,學長會搶著讓你飛高高,學長會搶著讓飛高高,0
會被學長修理，軍校學長才是實際管理者,會被學長修理，軍校學長才是實際管理者,會被學長修理，軍校學長才是實際管理者,0
陸官教授很多是外聘民人 根本不管你這些鳥事~,陸官教授很多是外聘民人根本不管你這些鳥事,陸官教授很多是外聘民人根本不管這些鳥事,0
不過 剛好讓學長們抓到整你的梗 XDD,不過剛好讓學長們抓到整你的梗XDD,不過剛好讓學長們抓到整的梗XDD,0
陸官會有機會讓你在學校吃早餐??別傻了,陸官會有機會讓你在學校吃早餐別傻了,陸官會有機會讓在學校吃早餐別傻了,0
學長會讓你飛啊☺,學長會讓你飛啊,學長會讓飛啊,0
教授會叫學生連、營長外加學指部指揮官去夾卵蛋,教授會叫學生連、營長外加學指部指揮官去夾卵蛋,教授會叫學生連、營長外加學指部指揮官去夾卵蛋,0
實習連長會電你,實習連長會電你,實習連長會電,0
去嘉義吃雞肉飯，鴨肉羹，砂鍋魚頭，漢堡超爽的,去嘉義吃雞肉飯，鴨肉羹，砂鍋魚頭，漢堡超爽的,去嘉義吃雞肉飯，鴨肉羹，砂鍋魚頭，漢堡超爽的,0
嘉義智障也超多喔 你等等就知道了,嘉義智障也超多喔你等等就知道了,嘉義智障也超多喔等等就知道了,0
才20年？,才20年？,才20年？,0
新建築在外圍吧,新建築在外圍吧,新建築在外圍吧,0
20年前的規劃??? 不然你要徵收土地 全嘉義都市計畫重劃?,20年前的規劃不然你要徵收土地全嘉義都市計畫重劃,20年前的規劃不然要徵收土地全嘉義都市計畫重劃,0
嘉義要看外圍啦 起碼他們的學校跟公園做的很好,嘉義要看外圍啦起碼他們的學校跟公園做的很好,嘉義要看外圍啦起碼的學校跟公園做的很好,0
你走在哪裡啊?,你走在哪裡啊,走在哪裡啊,0
嘉義要看後站 他們的馬路比前站寬多了,嘉義要看後站他們的馬路比前站寬多了,嘉義要看後站的馬路比前站寬多了,0
嘉義市的路比北部很多縣市還要平整喔,嘉義市的路比北部很多縣市還要平整喔,嘉義市的路比北部很多縣市還要平整喔,0
嘉義的舊城區，跟宜蘭的舊城區，感覺很像,嘉義的舊城區，跟宜蘭的舊城區，感覺很像,嘉義的舊城區，跟宜蘭的舊城區，感覺很像,0
嘉義最大的問題 是欠缺都市美學的人才 那個噴水池好好,嘉義最大的問題是欠缺都市美學的人才那個噴水池好好,嘉義最大的問題是欠缺都市美學的人才個噴水池好好,0
我怎麼覺得變得想不起來以前是什麼樣子了,我怎麼覺得變得想不起來以前是什麼樣子了,怎麼覺得變得想不起來以前是樣子了,0
的整建 還是有可能變地標,的整建還是有可能變地標,的整建還是有可能變地標,0
每個都市都需要一個清爽的舊城區,每個都市都需要一個清爽的舊城區,每個都市都需要一個清爽的舊城區,0
跟內地城市一樣貧窮落後,跟內地城市一樣貧窮落後,跟內地城市一樣貧窮落後,0
你是要高樓大廈那種的嗎,你是要高樓大廈那種的嗎,是要高樓大廈種的嗎,0
圓環禁止張貼廣告 外牆翻修 噴水池重新設計一下感覺就很,圓環禁止張貼廣告外牆翻修噴水池重新設計一下感覺就很,圓環禁止張貼廣告外牆翻修噴水池重新設計一下感覺就很,0
但是有些地方跟20年前的嘉義市不太一樣,但是有些地方跟20年前的嘉義市不太一樣,但是有些地方跟20年前的嘉義市不太一樣,0
我這兩天就跟一些基督徒親友開戰了。,我這兩天就跟一些基督徒親友開戰了。,兩天就跟一些基督徒親友開戰了。,0
他應該是天主教的..,他應該是天主教的,應該是天主教的,0
基督徒：那些人是假基督徒 真正基督徒絕對是充滿愛的,基督徒：那些人是假基督徒真正基督徒絕對是充滿愛的,基督徒：那些人是假基督徒真正基督徒絕對是充滿愛的,0
天主教不是基督教,天主教不是基督教,天主教不是基督教,0
他天主教的,他天主教的,天主教的,0
可是台灣沒有一樣東西不是假的,可是台灣沒有一樣東西不是假的,可是台灣沒有一樣東西不是假的,0
基本上，我是非常親基督教的，但就這事上，我無法認同基督,基本上，我是非常親基督教的，但就這事上，我無法認同基督,基本上，是非常親基督教的，但就事上，無法認同基督,0
教部份教徒的看法。,教部份教徒的看法。,教部份教徒的看法。,0
兩個基督徒互相指著對方說對方是假基督徒 這就是基督徒,兩個基督徒互相指著對方說對方是假基督徒這就是基督徒,兩個基督徒互相指著說是假基督徒就是基督徒,0
你把亞伯拉罕諸教混為一談？,你把亞伯拉罕諸教混為一談？,把亞伯拉罕諸教混為一談？,0
跟你說天主教很會轉灣 ，有些新教很肚爛天主教,跟你說天主教很會轉灣，有些新教很肚爛天主教,跟說天主教很會轉灣，有些新教很肚爛天主教,0
"天主教和護家盟靈恩派其實不親近,互相討厭可能還多一點",天主教和護家盟靈恩派其實不親近互相討厭可能還多一點,天主教和護家盟靈恩派其實不親近互相討厭可能還多一點,0
那現在去反同性婚姻的那些 都是新教? 還是兩者都有?,那現在去反同性婚姻的那些都是新教還是兩者都有,那現在去反同性婚姻的那些都是新教還是兩者都有,0
"亞伯拉罕諸教的概念中 是""基督宗教""和猶太教,伊斯蘭",亞伯拉罕諸教的概念中是基督宗教和猶太教伊斯蘭,亞伯拉罕諸教的概念中是基督宗教和猶太教伊斯蘭,0
"天主教,新教都只是""基督宗教""內的不同教會",天主教新教都只是基督宗教內的不同教會,天主教新教都只是基督宗教內的不同教會,0
看過靈恩派的寫文章把允許祭祖保留牌位的天主教講得很爛,看過靈恩派的寫文章把允許祭祖保留牌位的天主教講得很爛,看過靈恩派的寫文章把允許祭祖保留牌位的天主教講得很爛,0
他人好像挺好的，也不排斥伊斯蘭教,他人好像挺好的，也不排斥伊斯蘭教,好像挺好的，也不排斥伊斯蘭教,0
天主教較少評論新教，但一些新教宗派很愛戰天主教，想到就,天主教較少評論新教，但一些新教宗派很愛戰天主教，想到就,天主教較少評論新教，但一些新教宗派很愛戰天主教，想到就,0
提一下天主教的缺點。,提一下天主教的缺點。,提一下天主教的缺點。,0
"他自己承認雖然教義很蠢,但他沒辦法不信教.心靈脆弱滿可憐的",他自己承認雖然教義很蠢但他沒辦法不信教心靈脆弱滿可憐的,承認雖然教義很蠢但沒辦法不信教心靈脆弱滿可憐的,0
"妙禪有靈性佛，法輪功李洪志有法身,宋七力有分身,莊圓佛舞",妙禪有靈性佛，法輪功李洪志有法身宋七力有分身莊圓佛舞,妙禪有靈性佛，法輪功李洪志有法身宋七力有分身莊圓佛舞,0
三寶沒有極限~,三寶沒有極限,三寶沒有極限,0
可能少那一根差很多吧,可能少那一根差很多吧,可能少一根差很多吧,0
為什麼會交不到女朋友,為什麼會交不到女朋友,為什麼會交不到女朋友,0
閃現點燃放反啊,閃現點燃放反啊,閃現點燃放反啊,0
還沒打檔踩油門會有聲音 會誤踩真的是智障,還沒打檔踩油門會有聲音會誤踩真的是智障,還沒打檔踩油門會有聲音會誤踩真的是智障,0
少了小頭的腦子跟腦漿,少了小頭的腦子跟腦漿,少了小頭的腦子跟腦漿,0
這問題我也想很久阿 可能跟誤踩油門的道理差不多吧,這問題我也想很久阿可能跟誤踩油門的道理差不多吧,問題也想很久阿可能跟誤踩油門的道理差不多吧,0
一定是用雙腳開自排,一定是用雙腳開自排,一定是用雙腳開自排,0
你要先搞懂三寶,你要先搞懂三寶,要先搞懂三寶,0
最常見就是用雙腳開車，熊熊忘記哪一腳是油門哪一腳煞車，,最常見就是用雙腳開車，熊熊忘記哪一腳是油門哪一腳煞車，,最常見就是用雙腳開車，熊熊忘記一腳是油門一腳煞車，,0
或是同時踩下去,或是同時踩下去,或是同時踩下去,0
因為兩腳 end,因為兩腳end,因為兩腳end,0
就北七啊  換個婉轉的說法,就北七啊換個婉轉的說法,就北七啊換個婉轉的說法,0
因油門比剎車踏板大 而且三寶都用右腳踩剎車 左腳踩油門,因油門比剎車踏板大而且三寶都用右腳踩剎車左腳踩油門,因油門比剎車踏板大而且三寶都用右腳踩剎車左腳踩油門,0
跟趾腳法 這是拓海的高級技術 所以說台灣人開車技術好,跟趾腳法這是拓海的高級技術所以說台灣人開車技術好,跟趾腳法是拓海的高級技術所以說台灣人開車技術好,0
沒打空檔，踩著煞車轉身拿後座的東西，腳一滑就踩到油門,沒打空檔，踩著煞車轉身拿後座的東西，腳一滑就踩到油門,沒打空檔，踩著煞車轉身拿後座的東西，腳一滑就踩到油門,0
其實很多人都有踩錯過 多數時後能救回來沒事 反應不及的,其實很多人都有踩錯過多數時後能救回來沒事反應不及的,其實很多人都有踩錯過多數時後能救回來沒事反應不及的,0
就直接上新聞認證三寶,就直接上新聞認證三寶,就直接上新聞認證三寶,0
兩隻腳開車不成理由吧 難道你騎機車有催過左手把嗎,兩隻腳開車不成理由吧難道你騎機車有催過左手把嗎,兩隻腳開車不成理由吧難道騎機車有催過左手把嗎,0
踩踏板 大多數的人是用腳跟當支點,踩踏板大多數的人是用腳跟當支點,踩踏板大多數的人是用腳跟當支點,0
如果你的腳跟位置移動 就有機會發生誤踩,如果你的腳跟位置移動就有機會發生誤踩,如果的腳跟位置移動就有機會發生誤踩,0
有時候腦袋會一時打結,有時候腦袋會一時打結,有時候腦袋會一時打結,0
三寶一腳油門一腳煞車 ，又沒訓練過 ，有這結果不意外,三寶一腳油門一腳煞車，又沒訓練過，有這結果不意外,三寶一腳油門一腳煞車，又沒訓練過，有結果不意外,0
單腳同時踩油門跟煞車 才容易弄錯吧,單腳同時踩油門跟煞車才容易弄錯吧,單腳同時踩油門跟煞車才容易弄錯吧,0
幫四輪緩頰,幫四輪緩頰,幫四輪緩頰,0
我腳跟位置固定不動 從來不會誤踩,我腳跟位置固定不動從來不會誤踩,腳跟位置固定不動從來不會誤踩,0
有些車種油門踏板與煞車踏板同高度就很容易肇禍了,有些車種油門踏板與煞車踏板同高度就很容易肇禍了,有些車種油門踏板與煞車踏板同高度就很容易肇禍了,0
所以洗車機很容易有人爆衝 因為在洗車的時候 大家腳都會收,所以洗車機很容易有人爆衝因為在洗車的時候大家腳都會收,所以洗車機很容易有人爆衝因為在洗車的時候都會收,0
都死三寶 害人不淺,都死三寶害人不淺,都死三寶害人不淺,0
也有些人是踩油門發現空檔 急忙進檔,也有些人是踩油門發現空檔急忙進檔,也有些人是踩油門發現空檔急忙進檔,0
"不會催到左手把是因為左從來都沒用阿,跟開車雙腳又不一樣",不會催到左手把是因為左從來都沒用阿跟開車雙腳又不一樣,不會催到左手把是因為左從來都沒用阿跟開車雙腳又不一樣,0
一般的小型車車通常會設計油門踏板高度比煞車踏板低 這樣一,一般的小型車車通常會設計油門踏板高度比煞車踏板低這樣一,一般的小型車車通常會設計油門踏板高度比煞車踏板低這樣一,0
舉的例子完全不同意義,舉的例子完全不同意義,舉的例子完全不同意義,0
般的駕駛人一踩會先碰到煞車 誤踩油門機會就低甚多,般的駕駛人一踩會先碰到煞車誤踩油門機會就低甚多,般的駕駛人一踩會先碰到煞車誤踩油門機會就低甚多,0
因為三寶阿，無法理解是正常的,因為三寶阿，無法理解是正常的,因為三寶阿，無法理解是正常的,0
就邊開車邊想事情恍神而已   誤踩說法聽聽就好,就邊開車邊想事情恍神而已誤踩說法聽聽就好,就邊開車邊想事情恍神而已誤踩說法聽聽就好,0
就有低能用兩腳開車,就有低能用兩腳開車,就有低能用兩腳開車,0
還真有人兩腳用…長見識了,還真有人兩腳用長見識了,還真有人兩腳用長見識了,0
煞車 油門一起踩  車子會動嗎,煞車油門一起踩車子會動嗎,煞車油門一起踩車子會動嗎,0
自排車遇到陡坡起步若沒輔助系統還真的得用兩腳操作,自排車遇到陡坡起步若沒輔助系統還真的得用兩腳操作,自排車遇到陡坡起步若沒輔助系統還真的得用兩腳操作,0
有次鞋底髒 把右腳內翻90度 還真的一時忘了那個是刹車油門,有次鞋底髒把右腳內翻90度還真的一時忘了那個是刹車油門,有次鞋底髒把右腳內翻90度還真的一時忘了個是刹車油門,0
腦袋構造不同,腦袋構造不同,腦袋構造不同,0
因為誤踩剎車不會上新聞,因為誤踩剎車不會上新聞,因為誤踩剎車不會上新聞,0
雙腳開車~,雙腳開車,雙腳開車,0
其實ㄧ般新聞中爆衝的車輛 大部分都是單腳開車,其實般新聞中爆衝的車輛大部分都是單腳開車,其實般新聞中爆衝的車輛大部分都是單腳開車,0
車子衝出去的時候 煞車燈都沒亮,車子衝出去的時候煞車燈都沒亮,車子衝出去的時候煞車燈都沒亮,0
雙腳開車的問題是 在高速行進間 沒有煞車優先 緊急煞車可,雙腳開車的問題是在高速行進間沒有煞車優先緊急煞車可,雙腳開車的問題是在高速行進間沒有煞車優先緊急煞車可,0
能會煞不住 因為ㄧ邊煞車ㄧ邊補油門,能會煞不住因為邊煞車邊補油門,能會煞不住因為邊煞車邊補油門,0
