內文,內文_清理後,內文_斷詞後,手動標註
高收益通常伴隨高風險，謹慎投資是保護自己資金的最佳方式。,高收益通常伴隨高風險，謹慎投資是保護自己資金的最佳方式。,高收益通常伴隨高風險，謹慎投資是保護資金的最佳方式。,0
任何保證高回報、零風險的投資都是不可信的，請提高警覺。,任何保證高回報、零風險的投資都是不可信的，請提高警覺。,任何保證高回報、零風險的投資都是不可信的，請提高警覺。,0
投資前應詳細了解投資標的及相關風險，不要盲目跟風。,投資前應詳細了解投資標的及相關風險，不要盲目跟風。,投資前應詳細了解投資標的及相關風險，不要盲目跟風。,0
選擇合法、正規的投資管道，避免陷入詐騙陷阱。,選擇合法、正規的投資管道，避免陷入詐騙陷阱。,選擇合法、正規的投資管道，避免陷入詐騙陷阱。,0
如遇到陌生人推薦的投資機會，應該多方面核實其真實性。,如遇到陌生人推薦的投資機會，應該多方面核實其真實性。,如遇到陌生人推薦的投資機會，應該多方面核實真實性。,0
加入投資群組前，先了解該群組的背景及成員真實性。,加入投資群組前，先了解該群組的背景及成員真實性。,加入投資群組前，先了解該群組的背景及成員真實性。,0
不應輕信來路不明的投資建議，特別是網絡上的廣告或推薦。,不應輕信來路不明的投資建議，特別是網絡上的廣告或推薦。,不應輕信來路不明的投資建議，特別是網絡上的廣告或推薦。,0
在投資前，請先諮詢專業的財務顧問或投資顧問。,在投資前，請先諮詢專業的財務顧問或投資顧問。,在投資前，請先諮詢專業的財務顧問或投資顧問。,0
對於高收益的投資機會，應保持懷疑態度，並深入研究。,對於高收益的投資機會，應保持懷疑態度，並深入研究。,對於高收益的投資機會，應保持懷疑態度，並深入研究。,0
合法的投資管道如銀行、證券公司等是較為安全的選擇。,合法的投資管道如銀行、證券公司等是較為安全的選擇。,合法的投資管道如銀行、證券公司等是較為安全的選擇。,0
不要輕易向陌生人透露個人金融信息，以防被騙。,不要輕易向陌生人透露個人金融信息，以防被騙。,不要輕易向陌生人透露金融信息，以防被騙。,0
投資時，應分散風險，不要把所有資金投入同一個項目。,投資時，應分散風險，不要把所有資金投入同一個項目。,投資時，應分散風險，不要把所有資金投入同一個項目。,0
參考可信賴的財經資訊來源，避免盲目投資。,參考可信賴的財經資訊來源，避免盲目投資。,參考可信賴的財經資訊來源，避免盲目投資。,0
如有任何投資疑問，可撥打165防詐騙專線諮詢。,如有任何投資疑問，可撥打165防詐騙專線諮詢。,如有任何投資疑問，可撥打165防詐騙專線諮詢。,0
定期查看投資帳戶狀況，及早發現異常並處理。,定期查看投資帳戶狀況，及早發現異常並處理。,定期查看投資帳戶狀況，及早發現異常並處理。,0
投資前，請先了解該項目的合法性及風險程度。,投資前，請先了解該項目的合法性及風險程度。,投資前，請先了解該項目的合法性及風險程度。,0
不應輕信高回報的承諾，投資應以穩健為主。,不應輕信高回報的承諾，投資應以穩健為主。,不應輕信高回報的承諾，投資應以穩健為主。,0
定期參加投資講座或課程，提升自己的投資知識和技能。,定期參加投資講座或課程，提升自己的投資知識和技能。,定期參加投資講座或課程，提升的投資知識和技能。,0
如遇可疑的投資信息，應及時向有關部門舉報。,如遇可疑的投資信息，應及時向有關部門舉報。,如遇可疑的投資信息，應及時向有關部門舉報。,0
投資應量力而行，不應超出自己的經濟承受能力。,投資應量力而行，不應超出自己的經濟承受能力。,投資應量力而行，不應超出的經濟承受能力。,0
任何要求繳納保證金或手續費的投資機會都應謹慎對待。,任何要求繳納保證金或手續費的投資機會都應謹慎對待。,任何要求繳納保證金或手續費的投資機會都應謹慎對待。,0
不要輕信網絡上的投資廣告，特別是那些保證高回報的。,不要輕信網絡上的投資廣告，特別是那些保證高回報的。,不要輕信網絡上的投資廣告，特別是那些保證高回報的。,0
如遇到投資平台要求提供個人敏感信息，應提高警惕。,如遇到投資平台要求提供個人敏感信息，應提高警惕。,如遇到投資平台要求提供敏感信息，應提高警惕。,0
應選擇有良好信譽和業績的投資機構進行投資。,應選擇有良好信譽和業績的投資機構進行投資。,應選擇有良好信譽和業績的投資機構進行投資。,0
避免參與無法提供正規法律文件的投資活動。,避免參與無法提供正規法律文件的投資活動。,避免參與無法提供正規法律文件的投資活動。,0
投資前應查詢該投資機構的合法性和相關資質。,投資前應查詢該投資機構的合法性和相關資質。,投資前應查詢該投資機構的合法性和相關資質。,0
如對投資有任何疑問，應及時向專業人士尋求建議。,如對投資有任何疑問，應及時向專業人士尋求建議。,如對投資有任何疑問，應及時向專業人士尋求建議。,0
不要被高回報的承諾所迷惑，投資應保持理性。,不要被高回報的承諾所迷惑，投資應保持理性。,不要被高回報的承諾所迷惑，投資應保持理性。,0
選擇透明度高的投資平台，了解其運作模式。,選擇透明度高的投資平台，了解其運作模式。,選擇透明度高的投資平台，了解運作模式。,0
參與投資前，應對該項目進行全面的風險評估。,參與投資前，應對該項目進行全面的風險評估。,參與投資前，應對該項目進行全面的風險評估。,0
應選擇經政府監管的合法投資機構，避免非法集資風險。,應選擇經政府監管的合法投資機構，避免非法集資風險。,應選擇經政府監管的合法投資機構，避免非法集資風險。,0
不要輕信來歷不明的投資推薦，特別是通過社交媒體的。,不要輕信來歷不明的投資推薦，特別是通過社交媒體的。,不要輕信來歷不明的投資推薦，特別是通過社交媒體的。,0
投資前應了解清楚該項目的運作模式和風險因素。,投資前應了解清楚該項目的運作模式和風險因素。,投資前應了解清楚該項目的運作模式和風險因素。,0
如發現投資有異常，應立即停止投資並報警處理。,如發現投資有異常，應立即停止投資並報警處理。,如發現投資有異常，應立即停止投資並報警處理。,0
提高防範意識，避免落入高回報陷阱。,提高防範意識，避免落入高回報陷阱。,提高防範意識，避免落入高回報陷阱。,0
選擇有信譽的投資平台，並定期查看平台運營狀況。,選擇有信譽的投資平台，並定期查看平台運營狀況。,選擇有信譽的投資平台，並定期查看平台運營狀況。,0
不應輕信投資機會，應多方面核實其真實性。,不應輕信投資機會，應多方面核實其真實性。,不應輕信投資機會，應多方面核實真實性。,0
在網絡上進行投資時，應謹慎對待個人信息安全。,在網絡上進行投資時，應謹慎對待個人信息安全。,在網絡上進行投資時，應謹慎對待信息安全。,0
不要因貪圖高利潤而忽視投資風險，保持理性投資。,不要因貪圖高利潤而忽視投資風險，保持理性投資。,不要因貪圖高利潤而忽視投資風險，保持理性投資。,0
投資應以穩健為主，不應輕信來歷不明的高回報承諾。,投資應以穩健為主，不應輕信來歷不明的高回報承諾。,投資應以穩健為主，不應輕信來歷不明的高回報承諾。,0
如遇到高回報的投資機會，應多方面了解其風險。,如遇到高回報的投資機會，應多方面了解其風險。,如遇到高回報的投資機會，應多方面了解風險。,0
不應輕信陌生人的投資建議，應自己進行詳細調查。,不應輕信陌生人的投資建議，應自己進行詳細調查。,不應輕信陌生人的投資建議，應進行詳細調查。,0
選擇合法投資管道，如銀行、證券公司等，降低風險。,選擇合法投資管道，如銀行、證券公司等，降低風險。,選擇合法投資管道，如銀行、證券公司等，降低風險。,0
如有任何投資疑問，可諮詢專業的財務顧問。,如有任何投資疑問，可諮詢專業的財務顧問。,如有任何投資疑問，可諮詢專業的財務顧問。,0
投資前應了解該項目的法律風險及相關法律法規。,投資前應了解該項目的法律風險及相關法律法規。,投資前應了解該項目的法律風險及相關法律法規。,0
定期查看投資帳戶狀況，及早發現並處理異常。,定期查看投資帳戶狀況，及早發現並處理異常。,定期查看投資帳戶狀況，及早發現並處理異常。,0
應選擇有信譽和業績的投資機構進行投資。,應選擇有信譽和業績的投資機構進行投資。,應選擇有信譽和業績的投資機構進行投資。,0
提高防範意識，不輕易向陌生人透露個人金融信息。,提高防範意識，不輕易向陌生人透露個人金融信息。,提高防範意識，不輕易向陌生人透露金融信息。,0
投資應以穩健為主，不應輕信高回報的承諾。,投資應以穩健為主，不應輕信高回報的承諾。,投資應以穩健為主，不應輕信高回報的承諾。,0
如發現投資有異常，應立即停止投資並報警處理。,如發現投資有異常，應立即停止投資並報警處理。,如發現投資有異常，應立即停止投資並報警處理。,0
股票投資需要了解公司的基本面和行業前景，切勿盲目跟風。,股票投資需要了解公司的基本面和行業前景，切勿盲目跟風。,股票投資需要了解公司的基本面和行業前景，切勿盲目跟風。,0
虛擬貨幣投資需謹慎，市場波動較大，應了解技術和應用前景。,虛擬貨幣投資需謹慎，市場波動較大，應了解技術和應用前景。,虛擬貨幣投資需謹慎，市場波動較大，應了解技術和應用前景。,0
期貨交易有高風險，適合具備專業知識和經驗的投資者。,期貨交易有高風險，適合具備專業知識和經驗的投資者。,期貨交易有高風險，適合具備專業知識和經驗的投資者。,0
外匯投資需了解國際經濟形勢和匯率變動因素，謹慎操作。,外匯投資需了解國際經濟形勢和匯率變動因素，謹慎操作。,外匯投資需了解國際經濟形勢和匯率變動因素，謹慎操作。,0
基金投資是分散風險的好方法，應選擇適合自己的基金產品。,基金投資是分散風險的好方法，應選擇適合自己的基金產品。,基金投資是分散風險的好方法，應選擇適合的基金產品。,0
投資前應進行風險評估，確定自己的風險承受能力。,投資前應進行風險評估，確定自己的風險承受能力。,投資前應進行風險評估，確定的風險承受能力。,0
定期檢查投資組合，根據市場變化調整投資策略。,定期檢查投資組合，根據市場變化調整投資策略。,定期檢查投資組合，根據市場變化調整投資策略。,0
選擇有良好信譽和業績的投資機構和基金經理。,選擇有良好信譽和業績的投資機構和基金經理。,選擇有良好信譽和業績的投資機構和基金經理。,0
不要將所有資金投入一個投資項目，應分散投資。,不要將所有資金投入一個投資項目，應分散投資。,不要將所有資金投入一個投資項目，應分散投資。,0
投資需有長期規劃，避免短期炒作和頻繁操作。,投資需有長期規劃，避免短期炒作和頻繁操作。,投資需有長期規劃，避免短期炒作和頻繁操作。,0
了解市場趨勢和經濟走勢，有助於制定投資策略。,了解市場趨勢和經濟走勢，有助於制定投資策略。,了解市場趨勢和經濟走勢，有助於制定投資策略。,0
保持良好的投資心態，不要因市場波動而恐慌。,保持良好的投資心態，不要因市場波動而恐慌。,保持良好的投資心態，不要因市場波動而恐慌。,0
學習基本的財務知識，提升自己的投資能力。,學習基本的財務知識，提升自己的投資能力。,學習基本的財務知識，提升的投資能力。,0
遵循自己的投資計劃，不受市場情緒影響。,遵循自己的投資計劃，不受市場情緒影響。,遵循的投資計劃，不受市場情緒影響。,0
選擇合適的投資工具，如股票、債券、基金等。,選擇合適的投資工具，如股票、債券、基金等。,選擇合適的投資工具，如股票、債券、基金等。,0
投資需有紀律，避免盲目跟風和追漲殺跌。,投資需有紀律，避免盲目跟風和追漲殺跌。,投資需有紀律，避免盲目跟風和追漲殺跌。,0
合理設定投資目標，根據自身情況制定投資計劃。,合理設定投資目標，根據自身情況制定投資計劃。,合理設定投資目標，根據情況制定投資計劃。,0
定期檢視投資組合，根據市場變化進行調整。,定期檢視投資組合，根據市場變化進行調整。,定期檢視投資組合，根據市場變化進行調整。,0
了解投資產品的費用結構，避免不必要的成本。,了解投資產品的費用結構，避免不必要的成本。,了解投資產品的費用結構，避免不必要的成本。,0
保持投資的靈活性，根據市場變化調整策略。,保持投資的靈活性，根據市場變化調整策略。,保持投資的靈活性，根據市場變化調整策略。,0
選擇有透明度和良好信譽的投資平台。,選擇有透明度和良好信譽的投資平台。,選擇有透明度和良好信譽的投資平台。,0
了解投資產品的風險和回報，做出明智的決策。,了解投資產品的風險和回報，做出明智的決策。,了解投資產品的風險和回報，做出明智的決策。,0
避免高槓桿操作，控制風險，保護資金安全。,避免高槓桿操作，控制風險，保護資金安全。,避免高槓桿操作，控制風險，保護資金安全。,0
不要輕信高回報的承諾，投資需謹慎考慮。,不要輕信高回報的承諾，投資需謹慎考慮。,不要輕信高回報的承諾，投資需謹慎考慮。,0
根據自己的風險承受能力選擇適合的投資產品。,根據自己的風險承受能力選擇適合的投資產品。,根據的風險承受能力選擇適合的投資產品。,0
保持良好的資金管理，避免過度投資和負債。,保持良好的資金管理，避免過度投資和負債。,保持良好的資金管理，避免過度投資和負債。,0
選擇有良好歷史業績的基金或投資產品。,選擇有良好歷史業績的基金或投資產品。,選擇有良好歷史業績的基金或投資產品。,0
定期參加投資講座或課程，提升自己的投資知識。,定期參加投資講座或課程，提升自己的投資知識。,定期參加投資講座或課程，提升的投資知識。,0
不要盲目跟隨市場熱點，應有自己的投資判斷。,不要盲目跟隨市場熱點，應有自己的投資判斷。,不要盲目跟隨市場熱點，應有的投資判斷。,0
投資需有耐心，避免短期操作和頻繁交易。,投資需有耐心，避免短期操作和頻繁交易。,投資需有耐心，避免短期操作和頻繁交易。,0
了解投資產品的法律風險和監管情況，確保合法合規。,了解投資產品的法律風險和監管情況，確保合法合規。,了解投資產品的法律風險和監管情況，確保合法合規。,0
保持對市場的敏感度，及時了解最新的市場動態。,保持對市場的敏感度，及時了解最新的市場動態。,保持對市場的敏感度，及時了解最新的市場動態。,0
根據自己的投資目標和風險承受能力，制定合理的投資計劃。,根據自己的投資目標和風險承受能力，制定合理的投資計劃。,根據的投資目標和風險承受能力，制定合理的投資計劃。,0
定期檢視投資績效，根據市場變化調整投資策略。,定期檢視投資績效，根據市場變化調整投資策略。,定期檢視投資績效，根據市場變化調整投資策略。,0
保持良好的投資紀律，避免情緒化操作。,保持良好的投資紀律，避免情緒化操作。,保持良好的投資紀律，避免情緒化操作。,0
合理配置資產，分散風險，提高投資回報。,合理配置資產，分散風險，提高投資回報。,合理配置資產，分散風險，提高投資回報。,0
選擇有良好信譽的投資顧問，提供專業的投資建議。,選擇有良好信譽的投資顧問，提供專業的投資建議。,選擇有良好信譽的投資顧問，提供專業的投資建議。,0
了解投資產品的費用結構，避免隱藏成本。,了解投資產品的費用結構，避免隱藏成本。,了解投資產品的費用結構，避免隱藏成本。,0
保持投資的靈活性，根據市場變化調整投資策略。,保持投資的靈活性，根據市場變化調整投資策略。,保持投資的靈活性，根據市場變化調整投資策略。,0
參考多方資訊，做出明智的投資決策。,參考多方資訊，做出明智的投資決策。,參考多方資訊，做出明智的投資決策。,0
避免高風險投資，根據自己的風險承受能力選擇產品。,避免高風險投資，根據自己的風險承受能力選擇產品。,避免高風險投資，根據的風險承受能力選擇產品。,0
保持對市場的敏感度，及時了解最新的市場動態。,保持對市場的敏感度，及時了解最新的市場動態。,保持對市場的敏感度，及時了解最新的市場動態。,0
合理配置資產，分散風險，提高投資回報。,合理配置資產，分散風險，提高投資回報。,合理配置資產，分散風險，提高投資回報。,0
選擇有良好歷史業績的基金或投資產品。,選擇有良好歷史業績的基金或投資產品。,選擇有良好歷史業績的基金或投資產品。,0
了解投資產品的法律風險和監管情況，確保合法合規。,了解投資產品的法律風險和監管情況，確保合法合規。,了解投資產品的法律風險和監管情況，確保合法合規。,0
根據自己的投資目標和風險承受能力，制定合理的投資計劃。,根據自己的投資目標和風險承受能力，制定合理的投資計劃。,根據的投資目標和風險承受能力，制定合理的投資計劃。,0
保持良好的投資心態，不要因市場波動而恐慌。,保持良好的投資心態，不要因市場波動而恐慌。,保持良好的投資心態，不要因市場波動而恐慌。,0
學習基本的財務知識，提升自己的投資能力。,學習基本的財務知識，提升自己的投資能力。,學習基本的財務知識，提升的投資能力。,0
遵循自己的投資計劃，不受市場情緒影響。,遵循自己的投資計劃，不受市場情緒影響。,遵循的投資計劃，不受市場情緒影響。,0
投資需有紀律，避免盲目跟風和追漲殺跌。,投資需有紀律，避免盲目跟風和追漲殺跌。,投資需有紀律，避免盲目跟風和追漲殺跌。,0
在網路上購物時，選擇有良好信譽和歷史的網路商家或平臺是非常重要的。可以查看其他買家的評價和反饋，以確保商家提供的商品和服務質量。,在網路上購物時，選擇有良好信譽和歷史的網路商家或平臺是非常重要的。可以查看其他買家的評價和反饋，以確保商家提供的商品和服務質量。,在網路上購物時，選擇有良好信譽和歷史的網路商家或平臺是非常重要的。可以查看其他買家的評價和反饋，以確保商家提供的商品和服務質量。,0
為了保障交易的安全性，應選擇使用提供第三方支付的網購平臺，如信用卡支付或PayPal，這樣可以在交易出現問題時得到更好的保障和支持。,為了保障交易的安全性，應選擇使用提供第三方支付的網購平臺，如信用卡支付或PayPal，這樣可以在交易出現問題時得到更好的保障和支持。,為了保障交易的安全性，應選擇使用提供第三方支付的網購平臺，如信用卡支付或PayPal，這樣可以在交易出現問題時得到更好的保障和支持。,0
在購買商品前，仔細閱讀商品描述和規格，並確保賣家提供詳細的產品圖片。這有助於避免因信息不充分而買到不符合期望的商品。,在購買商品前，仔細閱讀商品描述和規格，並確保賣家提供詳細的產品圖片。這有助於避免因信息不充分而買到不符合期望的商品。,在購買商品前，仔細閱讀商品描述和規格，並確保賣家提供詳細的產品圖片。有助於避免因信息不充分而買到不符合期望的商品。,0
盡量避免與賣家私下交易，特別是通過LINE、Messenger或WhatsApp等通訊軟體進行交易。這樣的交易方式風險較高，且難以保障交易安全。,盡量避免與賣家私下交易，特別是通過LINE、Messenger或WhatsApp等通訊軟體進行交易。這樣的交易方式風險較高，且難以保障交易安全。,盡量避免與賣家私下交易，特別是通過LINE、Messenger或WhatsApp等通訊軟體進行交易。這樣的交易方式風險較高，且難以保障交易安全。,0
在網路購物時，應保持警惕，不要被過於便宜的價格所吸引。價格明顯低於市場價的商品往往存在風險，可能是劣質商品或詐騙。,在網路購物時，應保持警惕，不要被過於便宜的價格所吸引。價格明顯低於市場價的商品往往存在風險，可能是劣質商品或詐騙。,在網路購物時，應保持警惕，不要被過於便宜的價格所吸引。價格明顯低於市場價的商品往往存在風險，可能是劣質商品或詐騙。,0
若選擇貨到付款方式，應在簽收前仔細檢查包裹外觀是否完好無損。如有損壞或異常，應拒收包裹並立即與賣家或平臺聯繫。,若選擇貨到付款方式，應在簽收前仔細檢查包裹外觀是否完好無損。如有損壞或異常，應拒收包裹並立即與賣家或平臺聯繫。,若選擇貨到付款方式，應在簽收前仔細檢查包裹外觀是否完好無損。如有損壞或異常，應拒收包裹並立即與賣家或平臺聯繫。,0
在購物前，可以通過經濟部商業司網站查詢商家的營業登記信息，確認商家的真實性和合法性。這有助於避免與虛假商家交易。,在購物前，可以通過經濟部商業司網站查詢商家的營業登記信息，確認商家的真實性和合法性。這有助於避免與虛假商家交易。,在購物前，可以通過經濟部商業司網站查詢商家的營業登記信息，確認商家的真實性和合法性。有助於避免與虛假商家交易。,0
選擇面交方式購物也是一種保障交易安全的好方法。這樣可以當面檢查商品質量，確保與描述一致，並避免購買到假貨或劣質商品。,選擇面交方式購物也是一種保障交易安全的好方法。這樣可以當面檢查商品質量，確保與描述一致，並避免購買到假貨或劣質商品。,選擇面交方式購物也是一種保障交易安全的好方法。這樣可以當面檢查商品質量，確保與描述一致，並避免購買到假貨或劣質商品。,0
訂購貴重商品如3C產品、名牌包或限量球鞋時，應優先選擇知名度高且有保固的商家，並要求提供購買憑證和發票。,訂購貴重商品如3C產品、名牌包或限量球鞋時，應優先選擇知名度高且有保固的商家，並要求提供購買憑證和發票。,訂購貴重商品如3C產品、名牌包或限量球鞋時，應優先選擇知名度高且有保固的商家，並要求提供購買憑證和發票。,0
若在購物過程中遇到問題或糾紛，應立即向消費者保護機構或相關主管部門投訴，以保障自身權益。,若在購物過程中遇到問題或糾紛，應立即向消費者保護機構或相關主管部門投訴，以保障自身權益。,若在購物過程中遇到問題或糾紛，應立即向消費者保護機構或相關主管部門投訴，以保障權益。,0
購物時應注意商家的退換貨政策，了解是否提供合理的退換貨服務，以便在收到不符合預期的商品時可以順利退貨。,購物時應注意商家的退換貨政策，了解是否提供合理的退換貨服務，以便在收到不符合預期的商品時可以順利退貨。,購物時應注意商家的退換貨政策，了解是否提供合理的退換貨服務，以便在收到不符合預期的商品時可以順利退貨。,0
